alimento_id,alimento,Carbohidratos,Energía,Lípidos,Proteína,Sodio
1000,"aceite, de ajonjoli",0.0,884.0,100.0,0.0,
1001,"aceite, de algodon",0.0,884.0,100.0,0.0,
1002,"aceite, de cacahuate",0.0,884.0,100.0,0.0,
1003,"aceite, de canola",0.0,884.0,100.0,0.0,
1004,"aceite, de canola",0.0,884.0,100.0,0.0,
1005,"aceite, de cartamo",0.0,884.0,100.0,0.0,
1006,"aceite, de coco",0.0,892.0,99.06,0.0,
1007,"aceite, de girasol",0.0,884.0,100.0,0.0,
1008,"aceite, de maiz",0.0,900.0,100.0,0.0,
1009,"aceite, de oliva",0.0,884.0,100.0,0.0,
1010,"aceite, de soya",0.0,884.0,100.0,0.0,
1011,aceite en aerosol (pam),0.0,843.75,93.75,0.0,
1012,"aceite, vegetal (promedio)",0.0,853.9,95.76,0.0,
1013,"aceite, vegetal promedio (canola, maiz, cartamo, girasol, soya y oliva, ponderado de ensanut 2016)",0.0,887.86,100.0,0.0,
1014,"aceite, vegetal promedio (cartamo, maiz, girasol, canola, soya, oliva, algodon, ajonjoli y cacahuate, ponderado de ensanut 2012)",0.0,887.32,99.99,0.0,
1015,"aderezo, todos tipos",10.36,337.83,32.75,0.41,
1016,"aderezo, agridulce (p/ensaladas)",3.7,15.0,0.0,0.1,
1017,"aderezo, cesar (p/ensaladas)",3.3,542.0,57.85,2.17,
1018,"aderezo, de mostaza dulce (p/ensaladas)",23.33,464.0,40.83,0.87,
1019,"aderezo, de queso azul o roquefort (p/ensaladas)",4.77,484.0,51.1,1.37,
1020,aderezo italiano (p/ensaladas),8.33,319.22,31.67,0.22,
1021,"aderezo, mil islas (p/ensaladas)",14.64,379.0,35.06,1.09,
1022,"aderezo, ranch (p/ensaladas)",5.9,430.0,44.54,1.32,
1023,lardo,0.0,902.0,100.0,0.0,
1024,"manteca, animal promedio",0.0,902.0,100.0,0.0,
1025,"manteca, vegetal promedio",0.0,884.0,99.97,0.0,
1026,"mantequilla, con sal",0.0,729.0,80.0,0.0,
1027,"mantequilla, sin sal",0.97,734.0,80.33,0.37,
1028,"margarina, con sal",1.66,739.22,80.66,1.66,
1029,"margarina, light",1.52,349.0,37.98,0.23,
1030,margarina sin sal (primavera chantilly),0.0,540.0,60.0,0.0,
1031,mayonesa,2.33,519.55,54.43,0.78,
1032,"mayonesa, light (anãlisis directo)",9.23,238.0,22.22,0.37,
1033,mayonesa light (promedio etiquetas),9.33,328.45,32.0,0.78,
1034,"sustituto de crema, light",75.0,439.68,15.12,0.9,
3000,algodon de azucar,89.25,357.0,0.0,0.0,
3001,"almibar de frutas, industrializado",85.13,341.0,0.0,0.0,
3002,"arroz con leche, preparacion estandarizada",23.36,125.1,1.89,3.43,
3003,aspartame (canderel-clãsico),87.0,360.0,0.0,0.0,
3004,azucar y estevia (splenda naturals),0.0,0.0,0.0,0.0,
3005,"azucar, mascabado",98.09,380.0,0.0,0.12,
3006,"azucar, morena",98.09,380.0,0.0,0.12,
3007,"azucar, promedio",98.72,382.33,0.0,0.08,
3008,"azucar, refinada",99.98,387.0,0.0,0.0,
3009,"bocadillos de garbanzo dulce, preparacion estandarizada",50.05,470.55,27.49,6.77,
3010,"bodoque dulce, preparacion estandarizada",38.74,212.98,4.26,6.11,
3011,bombon,81.3,318.0,0.2,1.8,
3012,cajeta,81.82,412.62,7.71,6.56,
3013,"calabaza en dulce, preparacion estandarizada",26.33,105.28,0.04,0.34,
3014,"camote con azucar, preparacion estandarizada",24.4,98.37,0.02,0.7,
3015,"capirotada, preparacion estandarizada",34.42,223.04,8.37,3.13,
3016,chamoy,20.0,100.0,0.0,0.0,
3017,chile con azucar (tipo miguelito),40.0,160.0,0.0,0.0,
3018,"chocolate en polvo enriquecido (nesquik, calctose)",86.2,371.5,2.0,3.15,
3019,chocolate en polvo sin enriquecer (abuelita en polvo),79.1,385.0,5.8,4.0,
3020,chocolate lãquido (estilo hersheys),61.11,268.59,1.32,3.08,
3021,"chocolate, amargo",45.9,598.0,42.63,7.79,
3022,"chocolate, blanco",59.24,539.0,32.09,5.87,
3023,"chocolate, blanco",59.24,539.0,32.09,5.87,
3024,"chocolate con azucar (abuelita, ibarra, etc)",80.64,427.17,10.11,3.7,
3025,"chocolate, con leche (carlos v, vaquita, etc)",54.56,515.83,29.4,7.68,
3026,"chocolate con menta (cubierta o relleno, tipo chocoretas)",76.0,480.0,16.0,4.0,
3027,"chocolate, relleno de almendra, avellana o cacahuate (tipo ferrero)",50.83,531.59,36.28,9.7,
3028,"chocolate, relleno de caramelo y nuez (snickers, milky way)",64.3,472.08,20.72,7.1,
3029,"chocolate, semi amargo",61.17,546.0,31.28,4.88,
3030,"chocolate, sin azucar, en polvo o macizo",45.63,517.13,36.33,6.42,
3031,"chocolate, tipo nutela",61.11,516.57,27.77,5.55,
3032,chongos zamoranos,17.39,136.45,5.05,5.36,
3033,cocada,42.98,284.84,13.16,1.74,
3034,"cocoa, en polvo",57.9,228.0,13.7,19.6,
3035,crema chantilly,12.49,257.0,22.22,3.2,
3036,"crema de coco, industrializada (para hacer postres y bebidas)",44.81,220.6,4.39,0.93,
3037,"crepa de nutella con nuez, preparacion estandarizada",24.66,292.62,19.11,7.38,
3038,"crepa de nutella, preparacion estandarizada",29.91,248.03,11.53,5.99,
3039,"crepa dulce (todos sabores), preparacion estandarizada",25.8,203.93,9.44,4.98,
3040,"dulce de chabacano, preparacion estandarizada",30.74,122.0,0.29,1.02,
3041,"dulce de chocolate, duvalin (todos sabores)",67.94,535.36,27.56,0.65,
3042,"dulce de leche, industrializado",78.0,377.0,5.0,5.0,
3043,"dulce de leche, preparacion estandarizada",22.97,123.48,2.52,2.5,
3044,"dulce de tamarindo en pasta (tipo pelãn, bombazo)",90.59,373.74,0.8,1.19,
3045,"dulce de tamarindo, tarugo o banderilla",47.37,182.38,0.24,1.08,
3046,"dulce, macizo (paletas, redondos, salvavidas, halls)",88.13,358.46,0.02,0.02,
3047,"dulce, tipo chiclosos",91.56,397.0,3.33,0.03,
3048,"empanada de arroz con leche, preparacion estandarizada",42.0,313.16,13.9,5.32,
3049,"empanada dulce, preparacion estandarizada",52.75,365.65,15.11,5.17,
3050,eritritol (livana),100.0,0.0,0.0,0.0,
3051,estevia (canderel-stevia) c/azãcar-sucralosa,98.0,400.0,0.0,0.0,
3052,estevia (natural fit),100.0,0.0,0.0,0.0,
3053,estevia (nutra light),100.0,0.0,0.0,0.0,
3054,estevia (splenda naturals),100.0,0.0,0.0,0.0,
3055,estevia-sacarosa (stevien),95.0,0.0,0.0,0.0,
3056,flan o gelatina (promedio),17.53,103.09,2.15,3.48,
3057,"flan preparado, industrializado",15.75,99.47,2.79,2.91,
3058,"flan, preparacion estandarizada",45.94,253.06,4.82,6.68,
3059,"fresas con crema, preparacion estandarizada",13.35,177.52,13.4,1.64,
3060,"fruta con crema y azucar (excepto fresas), preparacion estandarizada",22.43,143.25,6.21,1.43,
3061,"fruta cubierta de chocolate, preparacion estandarizada",25.94,220.51,11.64,3.4,
3062,"gelatina con agua, preparacion estandarizada",1.41,7.17,0.05,0.27,
3063,"gelatina de leche preparada, industrializada",17.7,116.47,3.13,4.33,
3064,"gelatina de leche, preparacion estandarizada",5.68,60.24,2.83,3.0,
3065,"gelatina light preparada, industrializada",0.9,19.09,0.9,1.81,
3066,"gelatina light, en polvo",80.21,198.0,0.0,15.67,
3067,gelatina en polvo,11.45,58.36,0.41,2.23,
3068,"goma de mascar, con azucar tipo bombiux o bubbaloo",75.29,324.29,0.17,0.0,
3069,goma de mascar (promedio),72.8,296.16,0.0,0.0,
3070,goma de mascar sin az?car (tipo trident),0.0,0.0,0.0,0.0,
3071,gomitas cubiertas de azucar,81.27,340.0,0.0,3.64,
3072,gomitas enchiladas,74.58,313.33,0.0,4.08,
3073,"gorditas de nata, preparacion estandarizada",55.17,318.52,6.82,9.07,
3074,"grenetina, en polvo",0.0,34.61,0.0,8.66,
3075,"helado con galleta, sandwich (tipo mordizco)",24.3,147.05,4.69,1.91,
3076,"helado, de chocolate",28.2,216.0,11.0,3.8,
3077,"helado, de fresa",27.6,192.0,8.4,3.2,
3078,helado de leche,23.04,209.75,11.49,3.36,
3079,"helado, de vainilla",23.6,207.0,11.0,3.5,
3080,"jalea o ate, de frutas (excepto membrillo)",54.16,276.66,0.0,0.0,
3081,ate de membrillo,59.05,240.67,0.05,0.69,
3082,jalea real,19.8,148.0,2.7,11.1,
3083,"jarabe, sabor a maple",78.13,312.52,0.0,0.0,
3084,leche condensada,66.53,345.85,5.82,7.25,
3085,leche condensada reducida en azucar (lechera light),62.0,282.0,0.3,7.7,
3086,"malvavisco cubierto de chocolate (malvabon, de la rosa, etc)",69.3,394.4,10.11,6.25,
3087,"mazapan, promedio",65.0,510.0,22.5,12.5,
3088,melaza,71.0,285.0,0.1,0.0,
3089,"mermelada, de manzana",49.33,197.33,0.0,0.0,
3090,mermelada de naranja,60.44,243.56,0.03,0.23,
3091,mermelada promedio (excepto naranja o manzana),57.87,224.81,0.3,0.65,
3092,mermelada reducida en calorãas (todos los sabores),32.46,130.53,0.0,0.0,
3093,"miel, de abeja",78.61,320.16,0.0,0.15,
3094,"miel, de caãa",72.6,294.0,0.2,0.5,
3095,"miel, de maiz",76.79,283.0,0.2,0.0,
3096,"miel, de maple",67.04,260.0,0.06,0.04,
3097,"natilla (todos sabores), preparacion estandarizada",14.11,124.5,5.45,4.2,
3098,nieve de frutas,20.03,86.72,0.33,0.67,
3099,"nieve de frutas con chamoy y chile en polvo, preparacion estandarizada",10.45,43.89,0.36,0.43,
3100,nuez o cacahuates cubiertos de chocolate,52.61,514.85,29.42,9.89,
3101,nutra sweet,89.08,365.0,0.0,2.17,
3102,obleas con cajeta,77.68,369.29,2.92,7.87,
3103,"palanqueta casera, preparacion estandarizada",46.25,414.21,24.3,5.8,
3104,"paleta de hielo, de agua (todos sabores)",18.81,71.7,0.0,0.0,
3105,"paleta de hielo, de leche sin cobertura",34.94,260.67,12.65,1.62,
3106,"paleta de hielo, de leche y cobertura de chocolate (tipo magnum)",22.02,238.09,15.15,3.4,
3107,"paleta payaso, ricolino",67.66,364.44,10.27,4.11,
3108,pasas,79.18,299.0,0.46,3.07,
3109,pasas cubiertas con chocolate,64.2,440.0,19.08,3.85,
3110,"pay de frutas (rebanada), preparacion estandarizada",33.14,399.85,27.62,7.37,
3111,"pay de queso (rebanada), preparacion estandarizada",33.31,293.83,13.71,7.4,
3112,"pepino con chamoy y polvito azucarado (tipo miguelito), preparacion estandarizada",5.97,23.95,0.11,0.58,
3113,piloncillo,93.8,375.0,0.0,0.0,
3114,queso de tuna,79.0,321.0,,1.3,
3115,raspado (promedio),17.98,89.26,0.91,0.47,
3116,splenda,91.17,336.0,0.0,0.0,
3117,sucralosa (canderel-sucarã) c/dextrosa,90.0,348.0,0.0,0.0,
3118,sucralosa (nutra light),92.0,392.0,0.0,0.0,
3119,sucralosa (splenda original lãquido),0.0,0.0,0.0,0.0,
3120,"tejocotes en dulce, preparacion estandarizada",31.48,126.6,0.24,0.33,
3121,"tlaxcal dulce, preparacion estandarizada",58.54,492.33,27.13,4.87,
4001,"chicharron de harina (sabritones, totis)",63.61,513.71,34.0,6.85,
4002,"chicharron de harina preparado con cueritos y verdura, preparacion estandarizada",8.24,192.93,15.56,7.97,
4003,"dorilocos (frituras de maiz con verdura, crema, queso, cueritos, etc), preparacion estandarizada",18.47,139.14,6.15,2.67,
4004,"fritura de frutas y verduras (platanos, manzanas, etc)",66.26,497.96,26.7,1.73,
4006,frituras de maiz sabor nachos,60.81,519.0,27.42,7.36,
4007,frituras de maiz sabor queso bajo en grasa,71.6,445.0,15.2,8.7,
4008,palomitas de maãz de aire (sin aceite),77.78,387.0,4.54,12.94,
4009,palomitas de maiz promedio (industrializadas y caseras),54.74,472.25,24.99,8.48,
4010,papas (sticks todas marcas),59.76,476.61,24.46,4.35,
4011,"papas en hojuelas (todas marcas: sabritas, barcel, etc.)",52.98,516.03,31.33,6.09,
4012,pita chips,68.26,457.0,15.2,11.79,
4013,pretzels,80.39,384.0,2.93,10.04,
5035,"atole  de  avena con leche, preparacion estandarizada",20.11,128.91,3.53,4.27,
5036,"atole  de ciruela sin leche, preparacion estandarizada",8.8,36.53,0.15,0.36,
5037,"atole  de vainilla con leche, preparacion estandarizada",11.53,83.6,2.93,2.87,
5038,"atole (cualquier tipo), preparacion estandarizada",16.33,85.21,1.49,1.99,
5039,atole (promedio),16.06,83.99,1.53,1.96,
5040,"atole agrio sin leche, preparacion estandarizada",6.71,29.18,0.31,0.8,
5041,"atole champurrado sin leche, preparacion estandarizada",13.18,57.01,0.31,0.37,
5042,atole de agua de pinole,35.89,173.31,2.86,2.1,
5043,atole de ajonjoli (con leche),16.51,100.41,3.19,2.15,
5044,atole de ajonjoli (sin leche),14.65,78.02,2.06,0.96,
5045,"atole de arroz con leche, preparacion estandarizada",31.03,147.02,1.51,2.09,
5046,"atole de arroz sin leche, preparacion estandarizada",8.39,34.36,0.04,0.28,
5047,"atole de avena con agua sin azucar, preparacion estandarizada",3.5,20.11,0.37,0.65,
5048,"atole de avena sin leche, preparacion estandarizada",14.87,65.48,0.43,0.76,
5049,atole de cacahuate (sin leche),18.54,104.96,3.0,2.01,
5050,"atole de camote sin leche, preparacion estandarizada",28.36,121.21,0.47,0.94,
5051,"atole de capulin sin leche, preparacion estandarizada",7.28,28.89,0.0,0.02,
5052,"atole de chocolate con leche, preparacion estandarizada",21.75,129.6,3.34,3.38,
5053,"atole de ciruela pasa sin leche, preparacion estandarizada",21.62,84.9,0.16,0.48,
5054,"atole de coco con leche, preparacion estandarizada",11.75,124.1,7.66,3.01,
5055,"atole de elote con chile y leche, preparacion estandarizada",14.47,86.11,2.31,3.0,
5056,"atole de elote sin leche, preparacion estandarizada",18.5,116.06,3.28,3.75,
5057,"atole de fresa con leche, preparacion estandarizada",13.03,88.86,2.87,2.82,
5058,"atole de frijol sin leche, preparacion estandarizada",20.56,92.52,0.22,2.27,
5059,"atole de garbanzo sin leche, preparacion estandarizada",16.52,78.11,0.58,1.97,
5060,"atole de guayaba con leche, preparacion estandarizada",8.98,56.89,1.61,1.59,
5061,"atole de jobo (atole blanco) sin leche, preparacion estandarizada",42.61,179.81,0.7,1.83,
5062,"atole de limon con leche, preparacion estandarizada",13.88,89.14,2.71,2.68,
5063,"atole de maiz con leche, preparacion estandarizada",26.34,146.69,3.1,3.8,
5064,"atole de maiz sin leche, preparacion estandarizada",15.77,76.4,0.94,1.77,
5065,"atole de maizena con leche, preparacion estandarizada",11.78,80.29,2.6,2.55,
5066,"atole de maizena sin leche, preparacion estandarizada",7.94,31.36,0.0,0.0,
5067,atole de masa con leche,18.44,108.97,2.83,2.99,
5068,atole de masa sin leche,5.26,21.07,0.04,0.08,
5069,"atole de masa sin leche, preparacion estandarizada",19.58,81.39,0.19,0.34,
5070,"atole de pina con leche, preparacion estandarizada",9.72,43.59,0.41,0.5,
5071,"atole dulce con chile sin leche, preparacion estandarizada",18.87,90.59,1.34,0.79,
5072,bebida de cafe  industrializada,12.6,71.0,1.38,1.98,
5073,"bebida de chocolate con agua (sin masa, ni maicena), preparacion estandarizada",16.13,85.43,2.02,0.74,
5074,"bebida de soya endulzada (tipo ades), industrializada",5.44,27.97,0.41,0.61,
5075,"bebida embotellada sabor naranja y toronja (no jugo), sin gas",11.42,45.68,0.0,0.0,
5076,"bebida embotellada sabor uva (no jugo), sin gas",9.36,37.42,0.0,0.0,
5077,"bebida energetica (tipo red bull, boost, monster)",10.65,43.1,0.02,0.07,
5078,"bebida rehidratante (gatorade, powerade)",5.62,22.5,0.0,0.0,
5079,bebidas o aguas de sabor con azucar adicionada (industrializadas),10.4,40.4,0.0,0.02,
5080,bebidas o aguas de sabor sin azucar adicionada,0.0,0.0,0.0,0.0,
5081,"cafe capuccino, preparacion estandarizada",8.06,49.26,1.4,1.52,
5082,cafe con azucar,5.23,22.5,0.01,0.35,
5083,"cafe con azucar, en polvo",68.5,394.45,9.05,9.75,
5084,"cafe con leche con azucar, preparacion estandarizada",8.28,50.8,1.39,1.48,
5085,"cafe con leche sin azucar, preparacion estandarizada",3.19,33.33,1.55,1.65,
5086,"cafe de grano descafeinado, preparado con agua",0.0,0.0,0.0,0.1,
5087,cafe de grano en polvo,63.4,226.0,14.8,12.6,
5088,"cafe diluido sin azucar, industrializado",0.34,2.0,0.0,0.1,
5089,"cafe diluido sin azucar, preparacion estandarizada",1.54,7.2,0.01,0.25,
5090,"cafe enriquecido, en polvo",64.53,295.15,2.15,12.91,
5091,"cafe expresso, preparacion estandarizada",61.14,286.22,0.41,9.89,
5092,"cafe frappe (moka, capuccino, c/ chantilli, etc.), preparacion estandarizada",13.4,67.0,0.93,1.53,
5093,"cafe instantaneo descafeinado, preparado con agua",0.43,2.0,0.0,0.12,
5094,"cafe instantaneo, en polvo (tipo nescafe clasico)",75.4,353.0,0.5,12.2,
5095,"cafe o te con azucar, preparacion estandarizada",2.63,10.69,0.0,0.1,
5096,cafe promedio (con azucar y sin azucar),3.67,15.0,0.01,0.12,
5097,cerveza de raiz (sin alcohol),10.6,41.0,0.0,0.0,
5098,"esquimo casero (todos sabores), preparacion estandarizada",11.05,94.13,2.78,2.73,
5099,"formula lactea entera (tipo nutrileche), fluida",5.67,55.67,3.0,1.92,
5100,"frape de frutas con leche, helado o yogurt (smoothie), industrializado",13.38,100.0,4.58,2.5,
5101,"frappe de frutas, sin leche (todos sabores), industrializado",9.39,45.44,0.55,0.94,
5102,"frapuccino (promedio), preparaci?n estandarizada",10.2,61.43,1.92,1.1,
5103,"frapuccino c/chocolate leche light, preparacion estandarizada",11.15,60.43,1.39,1.1,
5104,"frapuccino c/chocolate regular, preparacion estandarizada",11.22,68.24,2.18,1.19,
5105,"frapuccino de caf? c/leche light, preparacion estandarizada",9.17,54.15,1.62,1.01,
5106,"frapuccino de caf? regular, preparacion estandarizada",9.25,62.89,2.5,1.11,
5107,hielo en cubos,0.0,0.0,0.0,0.0,
5108,jarabes de sabores (concentrados para agua de sabor),58.22,289.1,2.96,1.51,
5109,"jugo de arandano, industrializado",14.28,59.4,0.18,0.25,
5110,"jugo de arroz, preparacion estandarizada",1.39,6.35,0.01,0.12,
5111,"jugo betabel con azãcar, natural",9.05,36.13,0.05,0.77,
5112,"jugo de betabel, natural",5.1,20.87,0.05,0.8,
5113,"jugo de caãa de azucar, natural",20.5,84.0,0.1,0.3,
5114,"jugo de ciruela pasa, industrializado",15.24,60.42,0.0,0.13,
5115,"jugo de fruta con verdura, industrializado (tipo chispazo)",8.85,35.24,0.0,0.14,
5116,"jugo de fruta con verdura, natural",11.15,46.0,0.01,0.3,
5117,"jugo de frutas con verduras con azãcar, natural",14.85,60.21,0.01,0.29,
5118,"jugo de frutas, industrializado (tipo boing, del valle, sonrisa y jumex)",12.64,50.91,0.11,0.13,
5119,"jugo de limon, natural",6.9,22.0,0.24,0.35,
5120,"jugo de manzana, industrializado",9.57,38.23,0.0,0.01,
5121,"jugo de naranja con azãcar, natural",14.71,52.54,0.53,0.29,
5122,"jugo de naranja, industrializado",11.45,47.17,0.03,0.29,
5123,"jugo de naranja, natural",11.0,38.0,0.55,0.3,
5124,"jugo de noni, natural",4.03,17.94,0.2,0.53,
5125,"jugo de piãa, industrializado",11.09,43.97,0.0,0.0,
5126,"jugo de piãa, natural",12.87,53.0,0.12,0.36,
5127,"jugo de tomate con almeja (clamato), industrializado",4.68,21.2,0.09,0.44,
5128,"jugo de tomate, industrializado",4.73,20.55,0.0,0.4,
5129,"jugo de toronja con azãcar, natural",12.98,53.5,0.1,0.48,
5130,"jugo de toronja, industrializado",12.4,52.15,0.08,0.45,
5131,"jugo de toronja, natural",9.2,39.0,0.1,0.5,
5132,"jugo de uva, industrializado",13.39,54.42,0.0,0.07,
5133,"jugo de verduras, industrializado",3.25,14.68,0.0,0.42,
5134,"jugo de zanahoria con azãcar, natural",11.55,44.88,0.11,0.67,
5135,"jugo de zanahoria, natural",7.7,30.0,0.11,0.7,
5136,jugos naturales sin azucar adicionada naranja/zanahoria (promedio),9.84,42.5,0.17,0.82,
5137,jugos o aguas de frutas con azucar adicionada (promedio),10.97,43.86,0.02,0.08,
5138,"licuado (todos sabores), industrializado",12.51,68.42,1.32,1.62,
5139,"licuado de cereales (avena, granola), preparacion estandarizada",15.19,110.93,3.74,3.69,
5140,"licuado de fresa, preparacion estandarizada",9.73,70.77,2.54,2.56,
5141,"licuado de frutas, preparacion estandarizada",13.35,78.08,2.11,2.33,
5142,"licuado de mamey, preparacion estandarizada",10.49,71.96,2.36,2.32,
5143,"licuado de mango, preparacion estandarizada",12.45,69.64,1.74,1.92,
5144,"licuado de manzana, preparacion estandarizada",11.76,71.43,1.91,1.91,
5145,"licuado de melon, preparacion estandarizada",9.85,74.78,2.77,2.76,
5146,"licuado de nuez y coco, preparacion estandarizada",10.69,123.36,7.97,3.26,
5147,"licuado de papaya, preparacion estandarizada",9.95,69.16,2.27,2.35,
5148,"licuado de platano, preparacion estandarizada",13.35,78.08,2.11,2.33,
5149,"licuado light (todos sabores), industrializado",21.58,96.0,0.39,3.68,
5150,licuado promedio,10.59,80.25,3.24,2.87,
5151,"malteada de vainilla, industrializada",10.24,66.76,1.6,2.85,
5152,"malteada, preparacion estandarizada",12.55,133.9,6.25,3.01,
5153,"naranjada/limonada, preparacion estandarizada",9.32,35.15,0.03,0.12,
5154,"nectar de frutas, industrializado",14.27,56.0,0.16,0.13,
5155,polvo para bebida con azucar (tipo tang),98.94,386.0,0.0,0.0,
5156,polvo para bebida con edulcorante (tipo clight),19.88,82.99,0.0,0.0,
5157,polvo para bebida sin endulzante (tipo clight),60.22,248.24,0.0,3.2,
5158,polvo para caf? capuchino y moka (con az?car),85.08,406.58,7.25,1.1,
5159,"polvo para preparar bebida, promedio (con azucar, sin azucar y con edulcorante)",68.4,222.61,0.15,0.41,
5160,"polvo para te, (tipo nestea, sin azucar)",91.52,368.0,0.0,0.32,
5161,"ponche de frutas, industrializado",11.94,47.0,0.0,0.0,
5162,"ponche de frutas, preparacion estandarizada",11.63,46.49,0.09,0.22,
5163,"pozol (bebida), preparacion estandarizada",14.31,96.1,3.79,1.49,
5164,"refresco de cola (coca-cola, pepsi, bigcola)",11.19,44.1,0.0,0.0,
5165,"refresco de manzana, industrializado",11.1,44.4,0.0,0.0,
5166,"refresco de sabor (naranja, toronja, etc.)",10.85,43.49,0.0,0.06,
5167,refresco de sabor limon y lima,9.48,37.92,0.0,0.0,
5168,"refresco light (todos los sabores, excepto cola)",0.25,0.95,0.0,0.0,
5169,refresco naranja,12.3,48.0,0.0,0.0,
5170,refresco sabor lima-limon,10.42,41.0,0.0,0.09,
5171,refresco sabor uva,11.2,43.0,0.0,0.0,
5172,"refresco, de cola light o de dieta",1.9,7.58,0.0,0.0,
5173,"refresco, ginger ale",9.44,37.85,0.0,0.0,
5174,"suero, preparacion estandarizada",1.32,5.29,0.0,0.0,
5175,"te (infusion sin azucar), preparacion estandarizada",0.0,0.01,0.0,0.0,
5176,te (promedio),0.2,1.0,0.0,0.0,
5177,"te arizona (todos sabores) fluido, industrializado",11.34,45.95,0.0,0.0,
5178,"te de manzanilla, infusion",0.2,1.0,0.0,0.0,
5179,"te helado industrializado (tipo nestea, lipton)",7.91,31.51,0.0,0.0,
5180,"te negro descafeinado, infusion",0.3,1.0,0.0,0.0,
5181,"te negro, infusion",0.3,1.0,0.0,0.0,
5182,te o cafe para adelgazar,44.0,176.0,0.0,0.0,
5183,"te o infusion con azucar u otro endulzante (miel, piloncillo, etc, promedio)",4.2,16.48,0.0,0.0,
5184,"te otros sabores excepto manzanilla, infusion",0.2,1.0,0.0,0.0,
5185,aguardiente,0.0,211.0,0.0,0.0,
5186,aguardiente (50% alcohol),0.0,295.0,0.0,0.0,
5187,"bebida alcoholica con leche, (pina colada, alfonso xiii), preparacion estandarizada",21.59,143.31,2.76,2.68,
5188,"bebida alcoholica sin leche (mojito, paloma, etc), preparacion estandarizada",10.28,69.49,0.04,0.16,
5189,cerveza (alcohol 4.5%),3.55,43.0,0.0,0.46,
5190,cerveza light (alcohol 4.0%),1.64,29.0,0.0,0.24,
5191,"cerveza michelada, preparacion estandarizada",4.75,40.78,0.03,0.53,
5192,"daiquiri , bebida alcoholica",6.94,186.0,0.06,0.06,
5193,ginebra (45% alcohol),0.0,315.0,0.0,0.0,
5194,licor de cafe (26.5% alcohol),46.8,336.0,0.3,0.1,
5195,"piãa colada, bebida alcoholica",22.66,174.0,1.88,0.42,
5196,pulque,6.1,47.0,0.0,0.4,
5197,"rompope casero, preparacion estandarizada",12.51,140.89,3.42,2.82,
5198,"rompope, industrializado",8.05,88.0,4.19,4.55,
5199,ron (40% alcohol),0.0,231.0,0.0,0.0,
5200,sidra (rosada o blanca),11.3,46.0,0.13,0.1,
5201,"tejuino (bebida de maiz fermentada), preparacion estandarizada",24.32,102.42,0.37,0.7,
5202,"tepache (fermentado de pina), preparacion estandarizada",21.65,86.54,0.0,0.0,
5203,tequila,0.0,231.0,0.0,0.0,
5204,vino blanco o rosado,3.2,82.5,0.0,0.22,
5205,vino tinto,2.61,85.0,0.0,0.07,
5206,vodka (40% alcohol),0.0,231.0,0.0,0.0,
5207,whisky (43% alcohol),0.1,250.0,0.0,0.0,
6000,avestruz (promedio),0.0,115.0,1.96,22.86,
6001,"carnero, cabeza cocida",0.0,111.0,5.6,14.2,
6002,"carnero, carne grasosa",0.0,287.0,25.0,15.6,
6003,"carnero, higado",2.9,141.0,5.0,21.0,
6004,"carnero, magra con hueso",0.0,160.0,8.61,20.65,
6005,"carnero, magra sin hueso",0.0,154.0,8.3,19.72,
6006,"carnero, patas cocidas",0.0,103.0,2.1,21.0,
6007,"carnero, semigrasosa",0.0,243.0,18.89,17.06,
6008,"cerdo, carne cocida",0.0,211.0,10.5,27.69,
6009,"cerdo, carne en canal",0.0,214.0,17.8,13.9,
6010,"cerdo, carne magra (sin grasa ni hueso)",1.0,130.0,5.2,19.8,
6011,"cerdo, carne molida",0.0,263.0,21.19,16.88,
6012,"cerdo, carne promedio",0.0,180.0,12.6,16.7,
6013,"cerdo, cecina",0.8,346.0,21.0,38.4,
6014,"cerdo, chuleta ahumada",0.0,170.0,9.03,20.71,
6015,"cerdo, costilla semigrasosa",0.0,286.0,23.6,18.5,
6016,"cerdo, cueritos",0.0,217.0,14.01,25.03,
6017,"cerdo, espaldilla",1.29,174.0,11.51,16.2,
6018,"cerdo, higado",2.5,129.0,3.7,21.4,
6019,"cerdo, patas frescas",0.0,258.0,18.8,22.1,
6020,"cerdo, pulmon",0.0,81.0,2.7,14.1,
6021,"cerdo, riãones",0.0,100.0,3.25,16.46,
6022,"cerdo, semigrasosa",1.0,204.0,13.9,18.8,
6023,chicharron de cerdo (con grasa),0.0,582.0,39.27,57.1,
6024,iguana (promedio),0.0,106.0,0.9,24.4,
6025,"res, aguayon",0.0,129.0,5.3,20.4,
6026,"res, agujas",0.0,153.0,7.9,20.4,
6027,"res, carne cocida",0.0,235.0,13.44,27.06,
6028,"res, carne grasosa con hueso",0.0,293.0,25.4,16.0,
6029,"res, carne grasosa sin hueso",0.0,293.0,25.4,16.0,
6030,"res, carne magra (sin grasa ni hueso)",0.0,140.0,6.3,20.9,
6031,"res, carne molida especial",0.0,173.0,10.0,20.7,
6032,"res, carne molida regular",0.0,262.0,21.2,17.9,
6033,"res, carne muy grasosa (carne con mucho tejido grasoso)",0.0,388.0,36.23,14.4,
6034,"res, carne seca",0.5,390.0,14.5,64.8,
6035,"res, carne semigrasosa (tipo bistec)",0.0,251.0,19.8,18.3,
6036,"res, cecina oreada",0.0,273.0,14.9,34.7,
6037,"res, chambarete",0.0,125.0,4.8,20.4,
6038,"res, corazon",2.6,105.0,3.8,17.0,
6039,"res, cuete",0.0,95.0,3.0,17.0,
6040,"res, estomago e intestinos crudos",0.0,94.0,4.0,14.6,
6041,"res, falda",0.0,105.0,1.7,22.4,
6042,"res, filete",0.0,119.0,2.5,24.0,
6043,"res, higado",5.2,136.0,3.9,20.0,
6044,"res, lengua",3.7,219.0,16.1,14.9,
6045,"res, patas",1.1,79.0,2.9,12.1,
6046,"res, pescuezo",0.0,149.0,7.3,20.7,
6047,"res, riãones",2.2,103.0,3.1,16.6,
6048,"res, sesos",0.0,146.0,11.9,9.8,
6049,"res, tripas",0.0,215.0,19.0,11.0,
6050,"res, ubre",0.0,230.0,18.7,15.4,
6051,"res, visceras promedio (sesos, estomago e intestino, higado, tripas, corazon, pescuezo. ponderado ensanut 2016)",1.09,130.08,7.99,13.59,
6052,"ternera, carne en canal",0.0,151.0,8.0,19.7,
6053,"venado, carne asada",0.0,138.0,2.2,29.5,
6054,"venado, carne magra cruda",0.0,120.0,4.0,21.0,
7000,armadillo (promedio),0.0,165.0,5.4,29.0,
7001,codorniz (promedio),0.0,192.0,12.05,19.63,
7002,conejo de crianza (promedio),0.0,154.0,8.0,20.4,
7003,gallina (promedio),0.0,171.0,10.9,18.1,
7004,ganso de crianza (promedio),0.0,366.0,33.6,15.9,
7005,liebre (promedio),0.0,135.0,5.0,21.0,
7006,paloma (promedio),0.0,252.0,19.8,18.5,
7007,pato (de crianza),0.0,332.0,28.4,19.1,
7008,pavo o guajolote (promedio),0.0,154.0,8.0,20.4,
7009,"pavo, ala",0.0,197.0,12.32,20.22,
7010,"pavo, pechuga con piel",0.0,157.0,7.02,21.89,
